{
  "id": "trust-proof",
  "component": "TrustProof.astro",
  "slots": [
    "badges"
  ],
  "propsSchema": "schemas/modules/trust-proof.schema.json",
  "editableFields": [
    "rating",
    "reviewCount",
    "proofItems"
  ],
  "variants": [
    "badge-row",
    "review-summary"
  ],
  "a11yRules": [
    "Preserve semantic headings",
    "Interactive controls must meet 44px tap target",
    "Color pairs must meet WCAG AA contrast"
  ],
  "contentSafetyRules": [
    "Do not render unverified claims as guarantees",
    "Keep CTA labels explicit"
  ]
}
